{
  "schema_version": "1.0.0",
  "twin_id": "twin_signal_scout_001",
  "decision_version": 1,
  "lifecycle_status": "green",
  "freshness": {
    "status": "fresh",
    "captured_at": "2026-07-13T14:52:00Z",
    "expires_at": "2026-07-13T16:52:00Z",
    "superseded_by": null,
    "message": "Evidence is fresh."
  },
  "availability": {
    "state": "available",
    "message": "Audit events are available.",
    "reason_code": null,
    "retryable": false,
    "last_attempt_at": "2026-07-13T14:59:00Z"
  },
  "events": [
    {
      "event_id": "evt_twin_requested_001",
      "twin_id": "twin_signal_scout_001",
      "sequence": 1,
      "event_type": "twin_requested",
      "phase": "intake",
      "status": "completed",
      "actor": {
        "type": "operator",
        "id": "usr_admin",
        "display_name": "admin"
      },
      "safe_summary": "Namespace Readiness Twin generation was requested.",
      "evidence_refs": [],
      "redacted": true,
      "created_at": "2026-07-13T14:50:00Z"
    }
  ],
  "page": {"limit": 25, "has_more": false, "next_cursor": null, "result_count": 1}
}
